id_heritage_site;name;description;geom;type;is_visible
1;Capilla Doctrinera ;La Capilla Doctrinera se encuentra ubicada en la Plaza Principal de Munciipio de Cuitiva, fue declarada Patrimonio Cultural Inmueble en el año 2004 ya que es un Monumento Historico Nacional, construida en el siglo XVII  por los misioneros Franciscanos y Don Juan de San Martín.;;Cultural ;
2;Poblado de Iza ;El Poblado de Iza es declarado monumento Nacional en el año 2002 gracias a la conservación de las 80 casas ubicadas en el centro del Muncipio, las cuales tienen arquitectura colonial y salvaguardan la historia y cultura prehispanica. ;;Cultural ;
3;Capilla de San Antonio;La Basílica, Convento, Capilla de San Antonio, fue declarada como Monumento Historico Nacional en el año 1975 siendo la primera iglesia construida por los frailes para evangelizar nuestros ancestros indigenas.;;Cultural ;
4;Centro Urbano de Monguí;En el año 1980 el Municipio de Monguí fue declarado el pueblo más lindo de Boyacá por su aspecto colonial y riquezas culturales y paisajisticas y en el 2010 fue incluido en la red de los 10 Pueblos Patrimonio de interés turístico en Colombia. ;;Cultural ;
5;Iglesia y Convento de San Francisco ;Declarado como Patrimonio de la Humanidad en el año 1975, este convento conserva su arquitectura y la historia que data de la epoca de la Nueva Granada.  ;;Cultural ;
6;Puente Colonial Calicanto;Este puente fue construido entre los años 1963 y 1715 por los indigenas de la tribu Sanohas, quienes por medio del mandato de los Españoles lo utilizarón para trasladar las piedras utilizadas en la construcción del convento y la Basilica de Mongui. Fue declarado como Patrimonio Nacilonal Cultural Inmueble en el año 1975. ;;Cultural ;
7;Estación del Ferrocarril Sogamoso;Declarado en 1996 como Patrimonio Material Inmueble, fue la primera estación de trenes funciono por casi trece años en el lugar donde hoy se encuentra la Plaza Seis de Septiembre, en diciembre de 1942 ;;Cultural ;
8;Páramo de Oceta;El páramo de Ocetá, considerado él más bello del mundo, un lugar que sobrepasa cualquier sinónimo de belleza, con su Ciudad de Piedra y sus multicolores jardines llenos de frailejones, lupinus y senesios, es definitivamente una de las últimas maravillas medio ambientales que se encuentran en Colombia.;;Natural;
9;Lago de Tota ;El lago de Tota es un cuerpo de agua natural situado en el departamento de Boyacá, Colombia, en jurisdicción de los municipios de Iza, Cuítiva, Tota y Aquitania. Se encuentra ubicado a 34 km al sur de Sogamoso;;Natural ;